{
  "schema_version": "1.0.0",
  "identificacao": {"processo_cnj": "0000001-00.2026.4.00.0001", "manifesto_sha256": "0000000000000000000000000000000000000000000000000000000000000000", "data_geracao": "2026-01-01T12:00:00-03:00"},
  "tipo_pericia": {"tipo": "VICIOS_CONSTRUTIVOS", "confianca": {"nivel": "ALTA", "score": 0.9}, "evidencias": ["Decisão fictícia delimita análise de manifestações alegadas"], "documentos_fonte": ["DOC-PJE-001"], "criterios": ["Objeto e método explicitamente delimitados"], "alternativas_consideradas": ["OUTRO"]},
  "subtipos_pericia": ["INSTALACOES_PREDIAIS"],
  "assunto_processual": {"texto": "Assunto fictício", "confianca": {"nivel": "ALTA"}, "documentos_fonte": ["DOC-PJE-001"], "status_verificacao": "VERIFICADO"},
  "controversia_processual": {"texto": "Divergência fictícia sobre condição técnica", "confianca": {"nivel": "ALTA"}, "documentos_fonte": ["DOC-PJE-001"], "status_verificacao": "VERIFICADO"},
  "tema_controvertido": {"texto": "Determinar tecnicamente a existência e natureza das condições alegadas", "confianca": {"nivel": "ALTA"}, "documentos_fonte": ["DOC-PJE-001"], "status_verificacao": "VERIFICADO"},
  "objeto_material": {"texto": "Edificação fictícia", "confianca": {"nivel": "ALTA"}, "documentos_fonte": ["DOC-PJE-001"], "status_verificacao": "VERIFICADO"},
  "objetivo_pericial": {"texto": "Sanear tecnicamente o tema delimitado", "confianca": {"nivel": "ALTA"}, "documentos_fonte": ["DOC-PJE-001"], "status_verificacao": "VERIFICADO"},
  "questoes_tecnicas": [{"id": "QT-001", "descricao": "Verificar a condição alegada", "origem": "Decisão fictícia", "necessidade_para_saneamento": "Esclarecer o tema", "quesitos_relacionados": [], "evidencias_disponiveis": ["Documento fictício"], "evidencias_necessarias": ["Vistoria"], "documentos_relacionados": ["DOC-PJE-001"], "ressalvas": ["RES-001"], "status_saneamento": "A_SANEAR", "confianca": {"nivel": "ALTA"}, "proveniencia": [{"arquivo": "processo-ficticio.pdf", "sha256": "0000000000000000000000000000000000000000000000000000000000000000", "documento_id": "DOC-PJE-001", "id_pje": "900001", "pagina_pdf": 3, "pagina_documento": 1, "pagina_original": null, "trecho": "Trecho fictício", "natureza": "DOCUMENTADO", "metodo_extracao": "TEXTO_DIGITAL", "confianca": {"nivel": "ALTA"}, "status_verificacao": "VERIFICADO"}]}],
  "quesitos": [], "matriz_cobertura": [],
  "ressalvas": [{"id": "RES-001", "categoria": "LIMITACAO_DE_VISTORIA", "descricao": "Vistoria ainda não realizada", "causa": "Etapa futura", "evidencia": "Ausência de registro de vistoria", "questoes_afetadas": ["QT-001"], "quesitos_afetados": [], "conclusoes_impedidas": ["Conclusão sobre constatação"], "conclusoes_ainda_permitidas": ["Planejamento"], "efeito_no_grau_de_certeza": "Impede conclusão de mérito", "proveniencia": [{"arquivo": "processo-ficticio.pdf", "sha256": "0000000000000000000000000000000000000000000000000000000000000000", "documento_id": "DOC-PJE-001", "id_pje": "900001", "pagina_pdf": 3, "pagina_documento": 1, "pagina_original": null, "trecho": "Trecho fictício", "natureza": "DOCUMENTADO", "metodo_extracao": "TEXTO_DIGITAL", "confianca": {"nivel": "ALTA"}, "status_verificacao": "VERIFICADO"}]}],
  "fatores_limitantes": ["Vistoria pendente"], "conflitos": [], "materias_excluidas": [],
  "documentos_relevantes": [{"documento_id": "DOC-PJE-001", "papel": "Decisão delimitadora fictícia", "autoridade": "DELIMITACAO_PRIMARIA", "justificativa": "Define o encargo"}],
  "documentos_ausentes": [], "metodologia_preliminar": ["Inspeção visual futura"],
  "modulos_tecnicos": [{"nome": "VICIOS_CONSTRUTIVOS", "prioridade": "PRINCIPAL", "sistemas": ["OUTRO"]}],
  "plano_pericial_preliminar": {"o_que_verificar": ["Condição alegada"], "o_que_fotografar": ["Objeto"], "o_que_medir": [], "ensaios_sugeridos": [], "equipamentos_sugeridos": [], "documentos_a_solicitar": [], "pontos_criticos": ["Limites do encargo"], "questoes_que_dependem_da_vistoria": ["QT-001"]},
  "memoria_referencial": {"fontes_disponiveis": 0, "itens_recuperados": [], "status": "INDISPONIVEL"},
  "conhecimento_normativo": {"fontes_disponiveis": 0, "itens_recuperados": [], "status": "INDISPONIVEL"},
  "autoauditoria": [{"criterio": "Tema deriva de fonte identificável", "resultado": "APROVADO", "observacao": "Decisão fictícia"}],
  "status": "APTO_PARA_PLANEJAMENTO",
  "proveniencia": [{"arquivo": "processo-ficticio.pdf", "sha256": "0000000000000000000000000000000000000000000000000000000000000000", "documento_id": "DOC-PJE-001", "id_pje": "900001", "pagina_pdf": 3, "pagina_documento": 1, "pagina_original": null, "trecho": "Trecho fictício", "natureza": "DOCUMENTADO", "metodo_extracao": "TEXTO_DIGITAL", "confianca": {"nivel": "ALTA"}, "status_verificacao": "VERIFICADO"}]
}
